index,info
1,고혈압은 아무렇지 않아 보여도 혈관이 조용히 ‘압박’을 주고 있는 상태라구요. 짠 음식 조금만 줄이면 혈관이 한숨 돌릴지도 몰라요!
2,당뇨병? 단 거를 싹 끊으라는 건 아니에요. 현미와 잡곡밥으로 바꾸면 혈당 관리에 큰 도움이 된답니다.
3,이상지질혈증은 말 그대로 혈액 속 ‘기름 범벅’ 상태! HDL이 청소부 역할을 하도록 도와주는 게 중요해요.
4,"간 건강은 우리 몸의 공장! 술을 적당히 마시고, 간에 좋은 채소와 과일을 챙겨 먹으면 간이 한결 편해진답니다."
5,"신장도 우리 몸의 필터예요. 물을 충분히 마시고, 소금을 과하게 섭취하지 않으면 신장이 건강해질 수 있어요."
6,고혈압은 자각 증상이 없는 ‘조용한 범인’이에요. 정기적으로 혈압을 재보면 위험을 미리 막을 수 있답니다.
7,"당뇨병 환자분들, 식후 2시간 혈당 체크를 습관화하면 ‘혈당 성적표’를 보듯 관리하기 쉬워져요."
8,"이상지질혈증 관리의 핵심은 불포화지방! 등 푸른 생선, 견과류 먹으면 혈관이 청소를 시작한답니다."
9,간질환 예방을 위해선 알코올 섭취 조절이 필수! 과음은 간에 큰 부담을 주니까요.
10,신장 건강을 위해 하루 8잔의 물은 꼭 마셔야 해요. 물 한 잔이 신장을 깨끗하게 해준답니다.
11,"고혈압 약만 믿지 말고, 저염식과 규칙적인 운동으로 혈압 관리하는 습관을 들여보세요!"
12,당뇨병은 인슐린이 제 역할을 못할 때 생기는 문제에요. 식사와 운동으로 인슐린 저항성을 줄여보세요.
13,"이상지질혈증은 단순히 콜레스테롤 수치가 높다는 게 아니라, 혈관 건강의 ‘경고등’이랍니다."
14,"간은 우리 몸의 해독 기관! 신선한 채소와 과일, 그리고 적당한 운동으로 간 기능을 도와주세요."
15,"신장병은 초기에 별다른 증상이 없어서 몰랐다가 큰 문제로 번질 수 있으니, 정기 검진이 필수예요."
16,고혈압은 나이가 들수록 위험해져요. 젊을 때부터 건강한 식습관과 운동으로 예방하는 게 좋아요.
17,당뇨병 관리의 첫걸음은 ‘규칙적인 식사’예요. 한 끼 한 끼 천천히 드시면 혈당 조절에 도움이 돼요.
18,이상지질혈증은 나쁜 콜레스테롤(LDL)과 좋은 콜레스테롤(HDL)의 밸런스가 핵심이죠. 관리 잘하면 혈관이 웃어요.
19,"간 건강을 위해서는 지방이 많은 음식은 살짝 줄이고, 신선한 식재료로 요리하는 게 좋아요."
20,신장 질환 예방에는 고염식 피하기가 필수! 소금 섭취 줄이면 신장이 훨씬 편해질 거예요.
21,고혈압은 스트레스와도 깊은 연관이 있어요. 가벼운 산책이나 명상으로 스트레스 풀어보세요.
22,"당뇨병 환자분들은 당화혈색소(HbA1c) 관리에 집중하면, 지난 몇 달간의 혈당 조절을 한눈에 볼 수 있어요."
23,이상지질혈증 관리에는 유산소 운동이 효과적이에요. 걷기나 자전거 타기로 혈액 순환을 도와보세요.
24,"간 기능이 떨어지면 몸속 독소가 쌓여요. 간 건강에 좋은 식품, 예를 들어 마늘과 브로콜리 챙겨 드세요!"
25,신장 건강을 위해 카페인 음료도 적당히! 너무 많이 마시면 신장에 부담이 될 수 있거든요.
26,"고혈압은 ‘백의 고혈압’도 있는데, 병원에서는 긴장해서 나타나는 경우가 많으니 집에서 재보는 것도 좋아요."
27,당뇨병 예방을 위해선 꾸준한 운동과 균형 잡힌 식사가 필수! ‘걷기 챌린지’ 시작해보세요.
28,"이상지질혈증은 증상이 없으니, 정기적인 혈액 검사가 중요해요. 가끔은 수치가 말해주는 진실에 귀 기울이세요."
29,간질환 예방에는 규칙적인 생활 습관이 중요해요. 늦은 밤 야식은 간에게 큰 스트레스가 된답니다.
30,신장은 몸속 노폐물을 걸러내는 역할을 해요. 충분한 수분 섭취와 적당한 운동으로 신장도 기분 좋게!
31,고혈압 관리에는 저염식이 최고! 짠 음식을 조금 줄이면 혈관이 한결 편해진대요.
32,당뇨병 관리 시 혈당 모니터링은 필수! 하루 한 번 체크하는 습관이 큰 차이를 만들어요.
33,"이상지질혈증은 약물뿐 아니라, 식습관과 운동으로도 충분히 관리할 수 있으니 희망을 가져도 좋아요."
34,간은 체내 ‘정화 시스템’! 간 건강을 위해서는 적당한 운동과 균형 잡힌 식단이 꼭 필요해요.
35,"신장 건강을 위해 염분 섭취를 줄이고, 대신 허브나 향신료로 맛을 내보세요. 신장이 아주 고맙게 여길 거예요."
36,고혈압은 매일의 작은 습관이 큰 변화를 만든답니다. 계단 오르기부터 시작해보세요!
37,당뇨병 환자에게는 ‘규칙적인 식사’가 생명줄! 식사 시간을 일정하게 유지하는 게 중요해요.
38,이상지질혈증은 혈관에 쌓인 ‘기름 때’를 청소하는 기회! 유산소 운동으로 땀을 흘려보세요.
39,"간 건강을 위해서는 가공식품과 인스턴트 음식은 줄이고, 신선한 재료 위주로 식사해보세요."
40,신장 질환은 조기 발견이 관건! 정기적인 신장 기능 검사로 건강을 챙기세요.
41,"고혈압 약은 중요하지만, 생활습관 개선이 함께 이루어져야 더 큰 효과를 볼 수 있어요."
42,당뇨병은 식사 후 혈당이 천천히 오르게 하는 식습관이 중요해요. 식사는 천천히 즐기면서!
43,이상지질혈증 관리에는 오메가-3 지방산이 풍부한 식품이 큰 도움이 돼요. 고등어나 정어리 챙겨 드세요.
44,간 기능을 돕는 음식으로는 녹차가 있어요. 하루 한 잔의 녹차로 간 건강을 챙겨보세요.
45,신장 건강을 위해서는 단백질 섭취도 적절히 조절해야 해요. 과도한 단백질은 신장에 부담을 줄 수 있답니다.
46,고혈압은 운동과 식이요법의 결합으로 관리할 수 있어요. 가벼운 조깅 한 번 시작해보세요!
47,"당뇨병은 꾸준한 관리가 관건이에요. 식사, 운동, 약물 모두 하나의 팀워크랍니다."
48,"이상지질혈증은 콜레스테롤 숫자에 너무 집착하지 말고, 전반적인 식습관 개선에 초점을 맞춰보세요."
49,간 질환 예방에는 과도한 음주를 피하는 것이 최고! ‘적당히’라는 게 건강의 열쇠예요.
50,"신장 건강은 평소에 물 자주 마시고, 염분은 살짝 줄이는 습관으로 지킬 수 있어요."
51,"고혈압이 있다면, 아침에 가볍게 스트레칭하는 습관으로 하루를 시작해보세요. 혈액순환에 큰 도움이 된답니다."
52,당뇨병 관리의 또 다른 비결은 식사 전 손 씻기! 청결한 습관이 혈당 관리에도 긍정적인 영향을 줘요.
53,이상지질혈증은 운동을 병행하면 콜레스테롤 수치 개선에 큰 힘이 된답니다. 오늘도 산책 한 번 어떠세요?
54,간은 우리 몸의 디톡스 공장! 간 기능을 돕는 음식을 꾸준히 섭취하면 피로도 덜 느낄 거예요.
55,신장은 작지만 강한 필터! 신장 건강을 위해 매일 꾸준히 물 마시는 습관을 만들어보세요.
56,고혈압 예방에는 하루 30분의 유산소 운동이 효과적이에요. 가벼운 산책부터 시작해보세요!
57,당뇨병은 체중 관리와도 밀접한 관련이 있어요. 적정 체중 유지가 혈당 조절의 첫걸음이랍니다.
58,"이상지질혈증 환자라면, 정기적인 혈액 검사가 필수! 수치 관리로 건강을 지키세요."
59,간 건강은 충분한 휴식과 균형 잡힌 식사로 챙길 수 있어요. 밤새 야근 대신 푹 쉬는 것도 중요해요.
60,"신장은 과도한 약물 섭취도 부담스러워해요. 의사의 처방대로 복용하고, 생활습관 개선에도 힘 써보세요."
61,"고혈압 환자라면, 저염식을 실천하면서도 맛있는 허브 요리로 식사 즐길 수 있답니다."
62,"당뇨병은 식사 후 산책 한 번이 혈당 안정에 도움이 돼요. 식사 후 소화를 돕는 습관, 꼭 가져보세요!"
63,"이상지질혈증은 유전적 요인도 있지만, 올바른 식습관과 운동으로 충분히 개선될 수 있어요."
64,"간 건강을 위해서는 지방이 많은 튀김 음식 대신, 구이 또는 찜 요리를 선택해보세요."
65,"신장 질환 예방에는 염분뿐 아니라, 인스턴트 음식도 줄이는 것이 좋답니다."
66,고혈압은 혈압계를 자주 확인하는 습관이 중요해요. 집에서 간단히 재보면서 관리하세요.
67,"당뇨병 환자라면, 식사 전후 혈당 측정으로 하루를 관리해보세요. 숫자가 알려주는 건강 신호에 귀 기울이세요."
68,이상지질혈증 관리에는 오메가-3가 풍부한 생선 섭취가 큰 도움이 돼요. 주 2~3회 정도 챙겨 먹어보세요.
69,간은 피로가 쌓이면 기능이 떨어질 수 있어요. 충분한 수면과 휴식으로 간도 힐링해 주세요!
70,신장 건강을 위해 소금 대신 향신료로 맛을 내보는 것도 좋은 방법이에요. 색다른 맛에 도전해보세요.
71,"고혈압이 걱정된다면, 자극적인 음식 대신 부드러운 맛의 음식으로 식단을 조절해보세요."
72,당뇨병 관리에는 꾸준한 운동이 필수! 집에서 할 수 있는 스트레칭도 혈당 조절에 도움이 돼요.
73,이상지질혈증은 평소에 신선한 채소와 과일을 많이 먹으면 개선될 수 있어요. 자연의 선물을 챙기세요.
74,간 건강을 위해서 과일 주스보다는 신선한 과일을 직접 먹는 게 훨씬 좋아요. 섬유소도 풍부하답니다.
75,"신장 질환은 초기 증상이 없으니, 정기적인 건강 검진으로 미리 체크하는 것이 중요해요."
76,"고혈압은 운동할 때 심장이 기뻐하는 것처럼, 가벼운 조깅 한 번이 큰 변화를 만들 수 있어요."
77,"당뇨병 환자분들, 식사 시간을 일정하게 유지하는 것이 혈당 안정에 큰 도움이 된답니다."
78,이상지질혈증 관리에는 꾸준한 유산소 운동과 근력 운동의 병행이 중요해요. 두 마리 토끼를 잡아보세요!
79,"간 건강은 알맞은 식이섬유 섭취로 돕습니다. 잡곡, 채소, 과일이 간을 편하게 만들어 준답니다."
80,신장 건강을 위해 인공 첨가물이 적은 자연식품을 선택하는 것도 좋은 방법이에요.
81,고혈압은 꾸준한 생활 습관 개선으로 충분히 관리할 수 있어요. 작은 변화가 큰 결과를 만들죠.
82,당뇨병은 식사 후 혈당 급등을 막는 게 핵심! 천천히 꼭꼭 씹어 먹으면 혈당이 서서히 올라가요.
83,"이상지질혈증은 운동과 식단 개선으로 혈관 속 기름 때를 씻어낼 수 있어요. 땀 한 방울의 힘, 믿어보세요!"
84,간 건강은 술 마시는 횟수와 양 조절로도 크게 개선될 수 있어요. ‘적당히’가 키워드랍니다.
85,신장 질환 예방에는 고염식 피하기가 제일 중요해요. 음식의 염도도 가끔은 체크해보세요.
86,고혈압 관리에는 하루 30분 이상 걷기가 정말 효과적이에요. 가볍게 걸으며 건강도 챙기세요!
87,"당뇨병 환자라면, 인슐린 작용을 돕는 식품들을 챙겨 먹어보세요. 예를 들어, 섬유소가 풍부한 채소가 좋아요."
88,이상지질혈증은 꾸준한 혈액 검사를 통해 수치 변동을 체크하는 게 중요해요. 정기검진 잊지 마세요.
89,간 기능을 높이려면 비타민과 미네랄이 풍부한 음식을 골고루 섭취하는 게 좋아요.
90,신장 건강은 평소 무리한 다이어트보다는 균형 잡힌 식사가 중요해요. 몸에 무리 주지 말아요!
91,고혈압은 스트레스 관리와 함께라면 훨씬 안정되요. 좋아하는 음악이나 취미 생활로 마음을 달래보세요.
92,"당뇨병 관리에는 과식과 폭식을 피하는 게 중요해요. 적당한 양을 유지하는 습관, 꼭 가져보세요."
93,"이상지질혈증 환자라면, 정제된 탄수화물 대신 통곡물 섭취가 혈관 건강에 좋아요."
94,간 건강은 충분한 수면과 휴식으로도 크게 개선됩니다. 푹 자는 밤이 간에 선물이라구요.
95,"신장 건강을 위해 과일과 채소 위주의 식단을 유지하면, 신장이 훨씬 편안해져요."
96,고혈압은 건강한 체중 유지와 밀접한 관련이 있어요. 꾸준한 운동과 올바른 식습관으로 체중 관리하세요.
97,"당뇨병은 음식 조절과 꾸준한 운동, 그리고 필요시 약물 치료로 충분히 관리할 수 있어요."
98,이상지질혈증 관리에는 꾸준한 식이 요법과 정기적인 운동이 필수! 몸이 점점 가벼워지는 걸 느껴보세요.
99,간 질환 예방에는 신선한 재료로 만든 집밥이 최고! 가공식품 대신 정성 가득한 한 끼 어떠세요?
100,신장 질환은 평소에 소변 검사로 조기 발견할 수 있어요. 작은 징후에도 귀 기울이면 큰 문제를 막을 수 있답니다!